{
  "$schema": "http://json-schema.org/draft-07/schema#",
  "title": "AlterEyes UI Spec",
  "type": "object",
  "additionalProperties": true,
  "properties": {
    "theme": {
      "type": "object",
      "properties": {
        "bundle": {
          "enum": [
            "CleanSlate",
            "NeonArcade",
            "SoftFantasy"
          ]
        },
        "tokens": {
          "type": "object"
        },
        "variants": {
          "type": "object"
        }
      }
    },
    "views": {
      "type": "array",
      "items": {
        "$ref": "#/definitions/view"
      }
    },
    "popups": {
      "type": "array",
      "items": {
        "$ref": "#/definitions/popup"
      }
    },
    "presets": {
      "type": "array"
    },
    "flow": {
      "type": "object"
    }
  },
  "definitions": {
    "view": {
      "type": "object",
      "required": [
        "id"
      ],
      "properties": {
        "id": {
          "type": "string",
          "description": "\"Category/Name\""
        },
        "showAnimation": {
          "type": "string"
        },
        "hideAnimation": {
          "type": "string"
        },
        "background": {
          "type": "string",
          "description": "theme token"
        },
        "elements": {
          "type": "array",
          "items": {
            "$ref": "#/definitions/element"
          }
        }
      }
    },
    "popup": {
      "type": "object",
      "required": [
        "name"
      ],
      "properties": {
        "name": {
          "type": "string"
        },
        "title": {
          "type": "string"
        },
        "message": {
          "type": "string"
        },
        "size": {
          "type": "array",
          "items": {
            "type": "number"
          }
        },
        "close": {
          "type": "boolean",
          "description": "X dismiss button on the card corner"
        },
        "elements": {
          "type": "array",
          "items": {
            "$ref": "#/definitions/element"
          }
        }
      }
    },
    "element": {
      "type": "object",
      "minProperties": 1,
      "maxProperties": 1,
      "additionalProperties": false,
      "properties": {
        "button": {
          "$ref": "#/definitions/elementBody"
        },
        "toggle": {
          "$ref": "#/definitions/elementBody"
        },
        "switch": {
          "$ref": "#/definitions/elementBody"
        },
        "tab": {
          "$ref": "#/definitions/elementBody"
        },
        "slider": {
          "$ref": "#/definitions/elementBody"
        },
        "progress": {
          "$ref": "#/definitions/elementBody"
        },
        "tabbar": {
          "$ref": "#/definitions/elementBody"
        },
        "list": {
          "$ref": "#/definitions/elementBody"
        },
        "scroll": {
          "$ref": "#/definitions/elementBody"
        },
        "vstack": {
          "$ref": "#/definitions/elementBody"
        },
        "hstack": {
          "$ref": "#/definitions/elementBody"
        },
        "grid": {
          "$ref": "#/definitions/elementBody"
        },
        "panel": {
          "$ref": "#/definitions/elementBody"
        },
        "overlay": {
          "$ref": "#/definitions/elementBody"
        },
        "spacer": {
          "$ref": "#/definitions/elementBody"
        },
        "text": {
          "$ref": "#/definitions/elementBody"
        },
        "image": {
          "$ref": "#/definitions/elementBody"
        },
        "shape": {
          "$ref": "#/definitions/elementBody"
        },
        "icon": {
          "$ref": "#/definitions/elementBody"
        },
        "input": {
          "$ref": "#/definitions/elementBody"
        },
        "stepper": {
          "$ref": "#/definitions/elementBody"
        },
        "safearea": {
          "$ref": "#/definitions/elementBody"
        },
        "counter": {
          "$ref": "#/definitions/elementBody"
        },
        "dropdown": {
          "$ref": "#/definitions/elementBody"
        },
        "settings": {
          "$ref": "#/definitions/elementBody"
        },
        "cheats": {
          "$ref": "#/definitions/elementBody"
        }
      }
    },
    "elementBody": {
      "type": "object",
      "additionalProperties": true,
      "properties": {
        "id": {
          "type": "string",
          "description": "\"Category/Name\""
        },
        "label": {
          "type": "string"
        },
        "color": {
          "type": "string",
          "description": "theme token or #hex"
        },
        "labelColor": {
          "type": "string",
          "description": "theme token"
        },
        "background": {
          "type": "string",
          "description": "theme token or #hex"
        },
        "controls": {
          "type": "string",
          "description": "tab: id of the sibling panel it shows/hides"
        },
        "src": {
          "type": "string",
          "description": "image: sprite asset path (\"Assets/...\"); radius rounds the corners"
        },
        "bind": {
          "type": "string",
          "description": "list/grid: UIData source id feeding rows at runtime"
        },
        "item": {
          "$ref": "#/definitions/element"
        },
        "align": {
          "enum": [
            "left",
            "center",
            "right"
          ]
        },
        "anchor": {
          "enum": [
            "TopLeft",
            "Top",
            "TopRight",
            "Left",
            "Center",
            "Right",
            "BottomLeft",
            "Bottom",
            "BottomRight",
            "Stretch",
            "StretchTop",
            "StretchBottom",
            "StretchLeft",
            "StretchRight",
            "StretchHorizontal",
            "StretchVertical"
          ]
        },
        "shape": {
          "enum": [
            "RoundedRect",
            "Circle",
            "Pill",
            "Checkmark",
            "Chevron",
            "Cross",
            "Ring",
            "Arc"
          ]
        },
        "variant": {
          "enum": [
            "danger",
            "ghost",
            "light",
            "primary",
            "secondary"
          ]
        },
        "style": {
          "enum": [
            "Card",
            "Control",
            "ControlPill",
            "Panel",
            "ShadowSoft"
          ]
        },
        "textStyle": {
          "enum": [
            "Body",
            "ButtonLabel",
            "ButtonLabelLarge",
            "ButtonLabelSmall",
            "Caption",
            "Display",
            "Heading",
            "Title"
          ]
        },
        "icon": {
          "enum": [
            "play",
            "pause",
            "square",
            "skip-forward",
            "skip-back",
            "fast-forward",
            "rewind",
            "settings",
            "settings-2",
            "sliders-horizontal",
            "x",
            "check",
            "check-check",
            "chevron-up",
            "chevron-down",
            "chevron-left",
            "chevron-right",
            "chevrons-up",
            "chevrons-down",
            "chevrons-left",
            "chevrons-right",
            "arrow-up",
            "arrow-down",
            "arrow-left",
            "arrow-right",
            "arrow-up-right",
            "undo-2",
            "redo-2",
            "heart",
            "heart-crack",
            "star",
            "star-half",
            "sparkles",
            "coins",
            "gem",
            "diamond",
            "shield",
            "shield-check",
            "shield-alert",
            "sword",
            "swords",
            "axe",
            "crosshair",
            "target",
            "wand-sparkles",
            "shopping-bag",
            "shopping-cart",
            "backpack",
            "package",
            "gift",
            "lock",
            "lock-open",
            "key",
            "volume",
            "volume-1",
            "volume-2",
            "volume-x",
            "volume-off",
            "music",
            "mic",
            "mic-off",
            "bell",
            "bell-off",
            "user",
            "users",
            "user-plus",
            "circle-user",
            "smile",
            "frown",
            "trash",
            "trash-2",
            "pencil",
            "plus",
            "minus",
            "circle-plus",
            "circle-minus",
            "info",
            "circle-alert",
            "triangle-alert",
            "circle-help",
            "circle-check",
            "circle-x",
            "octagon-alert",
            "house",
            "search",
            "zoom-in",
            "zoom-out",
            "refresh-cw",
            "refresh-ccw",
            "rotate-cw",
            "rotate-ccw",
            "share-2",
            "external-link",
            "download",
            "upload",
            "save",
            "trophy",
            "medal",
            "crown",
            "award",
            "map",
            "map-pin",
            "compass",
            "flag",
            "clock",
            "timer",
            "hourglass",
            "calendar",
            "zap",
            "flame",
            "droplet",
            "snowflake",
            "sun",
            "moon",
            "cloud",
            "eye",
            "eye-off",
            "camera",
            "image",
            "video",
            "film",
            "gamepad-2",
            "dice-5",
            "puzzle",
            "ghost",
            "skull",
            "bot",
            "rocket",
            "wrench",
            "hammer",
            "menu",
            "ellipsis",
            "ellipsis-vertical",
            "list",
            "layout-grid",
            "filter",
            "send",
            "mail",
            "message-circle",
            "message-square",
            "phone",
            "wifi",
            "wifi-off",
            "battery",
            "battery-charging",
            "battery-low",
            "bluetooth",
            "power",
            "log-in",
            "log-out",
            "maximize",
            "minimize",
            "copy",
            "clipboard",
            "link",
            "paperclip",
            "pin",
            "bookmark",
            "tag",
            "folder",
            "file",
            "file-text",
            "book",
            "book-open",
            "lightbulb",
            "palette",
            "brush",
            "pipette",
            "move",
            "hand",
            "pointer",
            "thumbs-up",
            "thumbs-down",
            "banknote",
            "wallet",
            "credit-card",
            "scale",
            "leaf",
            "mountain",
            "anchor",
            "plane",
            "car",
            "bike",
            "footprints",
            "castle"
          ]
        },
        "name": {
          "enum": [
            "play",
            "pause",
            "square",
            "skip-forward",
            "skip-back",
            "fast-forward",
            "rewind",
            "settings",
            "settings-2",
            "sliders-horizontal",
            "x",
            "check",
            "check-check",
            "chevron-up",
            "chevron-down",
            "chevron-left",
            "chevron-right",
            "chevrons-up",
            "chevrons-down",
            "chevrons-left",
            "chevrons-right",
            "arrow-up",
            "arrow-down",
            "arrow-left",
            "arrow-right",
            "arrow-up-right",
            "undo-2",
            "redo-2",
            "heart",
            "heart-crack",
            "star",
            "star-half",
            "sparkles",
            "coins",
            "gem",
            "diamond",
            "shield",
            "shield-check",
            "shield-alert",
            "sword",
            "swords",
            "axe",
            "crosshair",
            "target",
            "wand-sparkles",
            "shopping-bag",
            "shopping-cart",
            "backpack",
            "package",
            "gift",
            "lock",
            "lock-open",
            "key",
            "volume",
            "volume-1",
            "volume-2",
            "volume-x",
            "volume-off",
            "music",
            "mic",
            "mic-off",
            "bell",
            "bell-off",
            "user",
            "users",
            "user-plus",
            "circle-user",
            "smile",
            "frown",
            "trash",
            "trash-2",
            "pencil",
            "plus",
            "minus",
            "circle-plus",
            "circle-minus",
            "info",
            "circle-alert",
            "triangle-alert",
            "circle-help",
            "circle-check",
            "circle-x",
            "octagon-alert",
            "house",
            "search",
            "zoom-in",
            "zoom-out",
            "refresh-cw",
            "refresh-ccw",
            "rotate-cw",
            "rotate-ccw",
            "share-2",
            "external-link",
            "download",
            "upload",
            "save",
            "trophy",
            "medal",
            "crown",
            "award",
            "map",
            "map-pin",
            "compass",
            "flag",
            "clock",
            "timer",
            "hourglass",
            "calendar",
            "zap",
            "flame",
            "droplet",
            "snowflake",
            "sun",
            "moon",
            "cloud",
            "eye",
            "eye-off",
            "camera",
            "image",
            "video",
            "film",
            "gamepad-2",
            "dice-5",
            "puzzle",
            "ghost",
            "skull",
            "bot",
            "rocket",
            "wrench",
            "hammer",
            "menu",
            "ellipsis",
            "ellipsis-vertical",
            "list",
            "layout-grid",
            "filter",
            "send",
            "mail",
            "message-circle",
            "message-square",
            "phone",
            "wifi",
            "wifi-off",
            "battery",
            "battery-charging",
            "battery-low",
            "bluetooth",
            "power",
            "log-in",
            "log-out",
            "maximize",
            "minimize",
            "copy",
            "clipboard",
            "link",
            "paperclip",
            "pin",
            "bookmark",
            "tag",
            "folder",
            "file",
            "file-text",
            "book",
            "book-open",
            "lightbulb",
            "palette",
            "brush",
            "pipette",
            "move",
            "hand",
            "pointer",
            "thumbs-up",
            "thumbs-down",
            "banknote",
            "wallet",
            "credit-card",
            "scale",
            "leaf",
            "mountain",
            "anchor",
            "plane",
            "car",
            "bike",
            "footprints",
            "castle"
          ]
        },
        "radius": {
          "type": "number"
        },
        "padding": {
          "type": "number"
        },
        "spacing": {
          "type": "number"
        },
        "min": {
          "type": "number"
        },
        "max": {
          "type": "number"
        },
        "value": {
          "type": "number"
        },
        "step": {
          "type": "number"
        },
        "fontSize": {
          "type": "number"
        },
        "badge": {
          "type": "number"
        },
        "thickness": {
          "type": "number"
        },
        "arcStart": {
          "type": "number"
        },
        "arcSweep": {
          "type": "number"
        },
        "columns": {
          "type": "integer"
        },
        "size": {
          "description": "button size variant (sm/md/lg) or [w,h]"
        },
        "position": {
          "type": "array",
          "items": {
            "type": "number"
          }
        },
        "cellSize": {
          "type": "array",
          "items": {
            "type": "number"
          }
        },
        "cascade": {
          "type": "boolean"
        },
        "gradient": {
          "type": "object",
          "properties": {
            "from": {
              "type": "string"
            },
            "to": {
              "type": "string"
            },
            "angle": {
              "type": "number"
            }
          }
        },
        "onClick": {
          "type": "object",
          "properties": {
            "signal": {
              "description": "\"Cat/Name\" or { category, name }"
            },
            "showView": {
              "type": "string"
            },
            "hideView": {
              "type": "string"
            },
            "popup": {
              "type": "string"
            },
            "close": {
              "type": "boolean",
              "description": "hides the enclosing popup/view"
            }
          }
        },
        "children": {
          "type": "array",
          "items": {
            "$ref": "#/definitions/element"
          }
        }
      }
    }
  }
}