{
  "theme": {
    "tokens": {
      "Primary": "#3B82F6",
      "Background": "#0B0D10",
      "Accent": "#FCA311",
      "TextDefault": "#C6CCD6",
      "Panel": "#1D2D50",
      "Surface": "#16191E",
      "SurfaceElevated": "#21252C",
      "Outline": "#343A44",
      "PrimaryHover": "#5D98F8",
      "PrimaryPressed": "#0F66F4",
      "TextOnPrimary": "#FFFFFF",
      "TextStrong": "#F5F7FA",
      "TextMuted": "#8E96A4",
      "Success": "#22C55E",
      "Warning": "#F59E0B",
      "Error": "#EF4444",
      "Shadow": "#00000080",
      "SuccessHover": "#30DB6F",
      "SuccessPressed": "#1B9E4B",
      "Danger": "#EF4444",
      "DangerHover": "#F26565",
      "DangerPressed": "#EB1A1A",
      "TextDark": "#6B6390"
    },
    "variants": {
      "Light": {
        "Primary": "#2563EB",
        "Background": "#F4F6F8",
        "Accent": "#FCA311",
        "TextDefault": "#303A49",
        "Panel": "#1D2D50",
        "Surface": "#FFFFFF",
        "SurfaceElevated": "#EAEEF3",
        "Outline": "#D3DAE3",
        "PrimaryHover": "#467AEE",
        "PrimaryPressed": "#134ECF",
        "TextOnPrimary": "#FFFFFF",
        "TextStrong": "#111827",
        "TextMuted": "#5D6675",
        "Success": "#15803D",
        "Warning": "#B45309",
        "Error": "#DC2626",
        "Shadow": "#00000038",
        "SuccessHover": "#1A9F4C",
        "SuccessPressed": "#0F592A",
        "Danger": "#DC2626",
        "DangerHover": "#E14545",
        "DangerPressed": "#B71D1D",
        "TextDark": "#6B6390"
      },
      "Dark": {
        "Primary": "#3B82F6",
        "Background": "#0B0D10",
        "Accent": "#FCA311",
        "TextDefault": "#C6CCD6",
        "Panel": "#1D2D50",
        "Surface": "#16191E",
        "SurfaceElevated": "#21252C",
        "Outline": "#343A44",
        "PrimaryHover": "#5D98F8",
        "PrimaryPressed": "#0F66F4",
        "TextOnPrimary": "#FFFFFF",
        "TextStrong": "#F5F7FA",
        "TextMuted": "#8E96A4",
        "Success": "#22C55E",
        "Warning": "#F59E0B",
        "Error": "#EF4444",
        "Shadow": "#00000080",
        "SuccessHover": "#30DB6F",
        "SuccessPressed": "#1B9E4B",
        "Danger": "#EF4444",
        "DangerHover": "#F26565",
        "DangerPressed": "#EB1A1A",
        "TextDark": "#6B6390"
      }
    }
  },
  "presets": [
    {
      "name": "ShowDefault",
      "type": "Show",
      "duration": 0.18000000715255737,
      "ease": "OutCubic",
      "scale": {
        "from": "0.96,0.96,1",
        "to": "1,1,1",
        "duration": 0.18000000715255737,
        "ease": "OutCubic"
      },
      "fade": {
        "from": 0,
        "to": 1,
        "duration": 0.18000000715255737,
        "ease": "OutCubic"
      }
    },
    {
      "name": "HideDefault",
      "type": "Hide",
      "duration": 0.18000000715255737,
      "ease": "OutCubic",
      "scale": {
        "from": "1,1,1",
        "to": "0.96,0.96,1",
        "duration": 0.18000000715255737,
        "ease": "OutCubic"
      },
      "fade": {
        "from": 1,
        "to": 0,
        "duration": 0.18000000715255737,
        "ease": "OutCubic"
      }
    },
    {
      "name": "SlideInLeft",
      "type": "Show",
      "duration": 0.34999999403953552,
      "ease": "OutCubic",
      "move": {
        "from": "Left",
        "duration": 0.34999999403953552,
        "ease": "OutCubic"
      },
      "fade": {
        "from": 0,
        "to": 1,
        "duration": 0.34999999403953552,
        "ease": "OutCubic"
      }
    },
    {
      "name": "SlideOutLeft",
      "type": "Hide",
      "duration": 0.25,
      "ease": "InCubic",
      "move": {
        "to": "Left",
        "duration": 0.25,
        "ease": "InCubic"
      },
      "fade": {
        "from": 1,
        "to": 0,
        "duration": 0.25,
        "ease": "InCubic"
      }
    },
    {
      "name": "SlideUpIn",
      "type": "Show",
      "duration": 0.40000000596046448,
      "ease": "OutCubic",
      "move": {
        "from": "Bottom",
        "duration": 0.40000000596046448,
        "ease": "OutCubic"
      },
      "fade": {
        "from": 0,
        "to": 1,
        "duration": 0.40000000596046448,
        "ease": "OutCubic"
      }
    },
    {
      "name": "SlideDownOut",
      "type": "Hide",
      "duration": 0.30000001192092896,
      "ease": "InCubic",
      "move": {
        "to": "Bottom",
        "duration": 0.30000001192092896,
        "ease": "InCubic"
      },
      "fade": {
        "from": 1,
        "to": 0,
        "duration": 0.30000001192092896,
        "ease": "InCubic"
      }
    },
    {
      "name": "PopIn",
      "type": "Show",
      "duration": 0.34999999403953552,
      "ease": "OutCubic",
      "scale": {
        "from": "0.85,0.85,1",
        "to": "1,1,1",
        "duration": 0.34999999403953552,
        "ease": "OutBack"
      },
      "fade": {
        "from": 0,
        "to": 1,
        "duration": 0.34999999403953552,
        "ease": "OutBack"
      }
    },
    {
      "name": "PopOut",
      "type": "Hide",
      "duration": 0.20000000298023224,
      "ease": "OutCubic",
      "scale": {
        "from": "1,1,1",
        "to": "0.9,0.9,1",
        "duration": 0.20000000298023224,
        "ease": "InQuad"
      },
      "fade": {
        "from": 1,
        "to": 0,
        "duration": 0.20000000298023224,
        "ease": "InQuad"
      }
    },
    {
      "name": "FadeIn",
      "type": "Show",
      "duration": 0.25,
      "ease": "OutCubic",
      "fade": {
        "from": 0,
        "to": 1,
        "duration": 0.25,
        "ease": "OutCubic"
      }
    },
    {
      "name": "FadeOut",
      "type": "Hide",
      "duration": 0.20000000298023224,
      "ease": "OutCubic",
      "fade": {
        "from": 1,
        "to": 0,
        "duration": 0.20000000298023224,
        "ease": "OutCubic"
      }
    }
  ],
  "views": [
    {
      "id": "Showcase/Popups",
      "background": "Background",
      "elements": [
        {
          "safearea": {
            "anchor": "Stretch",
            "children": [
              {
                "vstack": {
                  "anchor": "Center",
                  "size": [
                    520,
                    360
                  ],
                  "padding": 0,
                  "spacing": 16,
                  "children": [
                    {
                      "text": {
                        "label": "Popups",
                        "color": "TextStrong",
                        "textStyle": "Title"
                      }
                    },
                    {
                      "text": {
                        "label": "A plain confirm card and a rich popup with custom content.",
                        "color": "TextMuted",
                        "textStyle": "Caption"
                      }
                    },
                    {
                      "button": {
                        "id": "Popups/OpenPlain",
                        "label": "Open confirm",
                        "icon": "circle-help",
                        "labelColor": "TextOnPrimary",
                        "size": [
                          0,
                          56
                        ],
                        "textStyle": "ButtonLabel",
                        "onClick": {
                          "popup": "ConfirmDelete"
                        }
                      }
                    },
                    {
                      "button": {
                        "id": "Popups/OpenRich",
                        "label": "Open reward",
                        "icon": "gift",
                        "labelColor": "TextStrong",
                        "variant": "secondary",
                        "size": [
                          0,
                          56
                        ],
                        "textStyle": "ButtonLabel",
                        "onClick": {
                          "popup": "RewardClaim"
                        }
                      }
                    }
                  ]
                }
              }
            ]
          }
        }
      ]
    }
  ],
  "popups": [
    {
      "name": "ConfirmDelete",
      "title": "Delete save?",
      "message": "This permanently removes your progress. This cannot be undone."
    },
    {
      "name": "RewardClaim",
      "size": [
        560,
        460
      ],
      "close": true,
      "elements": [
        {
          "vstack": {
            "padding": 32,
            "spacing": 16,
            "children": [
              {
                "icon": {
                  "name": "trophy",
                  "color": "Primary",
                  "size": [
                    72,
                    72
                  ]
                }
              },
              {
                "text": {
                  "label": "Daily Reward",
                  "color": "TextStrong",
                  "textStyle": "Heading"
                }
              },
              {
                "text": {
                  "label": "You earned 500 coins for logging in today.",
                  "color": "TextMuted",
                  "textStyle": "Body"
                }
              },
              {
                "hstack": {
                  "padding": 0,
                  "spacing": 8,
                  "align": "center",
                  "children": [
                    {
                      "icon": {
                        "name": "coins",
                        "color": "Primary",
                        "size": [
                          36,
                          36
                        ]
                      }
                    },
                    {
                      "counter": {
                        "label": "#,0",
                        "labelColor": "TextStrong",
                        "size": [
                          160,
                          48